{
  "schema_version": 1,
  "id": "d65250b-page-039",
  "document_id": "d652-50b",
  "page": 39,
  "section": "A09",
  "type": "text",
  "titles": {
    "de": "Noch: 9. Ausbau eines Seitenvorgeleges mit Hilfe einer Hebevorrichtung.",
    "en-GB": "Continued: 9. Removing a final drive unit using a lifting device.",
    "es-ES": "Continuación: 9. Desmontaje de un engranaje lateral final con ayuda de un dispositivo elevador."
  },
  "source": {
    "image": "source.jpg",
    "pdf_spread": 21,
    "side": "right",
    "status": "extracted_clean",
    "display_image": "source_display.jpg"
  },
  "navigation": {
    "previous": "d65250b-page-038",
    "next": "d65250b-page-040"
  },
  "paragraphs": [
    {
      "id": "d65250b-p039-para01",
      "text": {
        "de": {
          "plain": "Durch gleichmäßiges Abdrücken mit zwei Brechstangen das Seitenvorgelege von der Panzerwanne abdrücken.",
          "runs": [
            {
              "text": "Durch gleichmäßiges Abdrücken mit zwei Brechstangen das Seitenvorgelege von der Panzerwanne abdrücken.",
              "bold": false
            }
          ]
        },
        "en-GB": {
          "plain": "Press the final drive unit off the armoured hull by levering evenly with two crowbars.",
          "runs": [
            {
              "text": "Press the final drive unit off the armoured hull by levering evenly with two crowbars.",
              "bold": false
            }
          ]
        },
        "es-ES": {
          "plain": "Separar el engranaje lateral final del casco blindado haciendo palanca de manera uniforme con dos palancas.",
          "runs": [
            {
              "text": "Separar el engranaje lateral final del casco blindado haciendo palanca de manera uniforme con dos palancas.",
              "bold": false
            }
          ]
        }
      }
    }
  ],
  "figures": [
    {
      "id": "d65250b-bild058",
      "number": 58,
      "image": null,
      "status": "candidate_crop",
      "captions": {
        "de": {
          "plain": "Bild 58",
          "runs": [
            {
              "text": "Bild 58",
              "bold": false
            }
          ]
        },
        "en-GB": {
          "plain": "Fig. 58",
          "runs": [
            {
              "text": "Fig. 58",
              "bold": false
            }
          ]
        },
        "es-ES": {
          "plain": "Fig. 58",
          "runs": [
            {
              "text": "Fig. 58",
              "bold": false
            }
          ]
        }
      },
      "label_keys": {
        "de": null,
        "en-GB": null,
        "es-ES": null
      }
    }
  ],
  "status": {
    "transcription": "draft",
    "en-GB": "draft",
    "es-ES": "draft",
    "figures": "pending"
  }
}
