{
  "schema_version": 1,
  "id": "d65250b-page-030",
  "document_id": "d652-50b",
  "page": 30,
  "section": "A06",
  "type": "text",
  "titles": {
    "de": "Noch: 6. Einbau der Bremstrommel und Bremsbacken der Stützbremse mit hydraulischer Lenkbetätigung.",
    "en-GB": "Continued: 6. Installing the brake drum and brake shoes of the support brake with hydraulic steering actuation.",
    "es-ES": "Continuación: 6. Montaje del tambor de freno y las zapatas de freno del freno de apoyo con accionamiento de dirección hidráulico."
  },
  "source": {
    "image": "source.jpg",
    "pdf_spread": 17,
    "side": "left",
    "status": "extracted_clean",
    "display_image": "source_display.jpg"
  },
  "navigation": {
    "previous": "d65250b-page-029",
    "next": "d65250b-page-031"
  },
  "paragraphs": [
    {
      "id": "d65250b-p030-para01",
      "text": {
        "de": {
          "plain": "¹) Siehe im Anhang.",
          "runs": [
            {
              "text": "¹) Siehe im Anhang.",
              "bold": false
            }
          ]
        },
        "en-GB": {
          "plain": "¹) See appendix.",
          "runs": [
            {
              "text": "¹) See appendix.",
              "bold": false
            }
          ]
        },
        "es-ES": {
          "plain": "¹) Véase el anexo.",
          "runs": [
            {
              "text": "¹) Véase el anexo.",
              "bold": false
            }
          ]
        }
      }
    }
  ],
  "figures": [
    {
      "id": "d65250b-bild043",
      "number": 43,
      "image": null,
      "status": "candidate_crop",
      "captions": {
        "de": {
          "plain": "Feder mit 2 Federtellern in die Vorrichtungsgabel stecken (Zeichnung 3)¹). Beachten: Beim Einsetzen müssen die Schlitze der Federteller übereinanderstehen.",
          "runs": [
            {
              "text": "Feder mit 2 Federtellern in die Vorrichtungsgabel stecken (Zeichnung 3)¹). Beachten: Beim Einsetzen müssen die Schlitze der Federteller übereinanderstehen.",
              "bold": false
            }
          ]
        },
        "en-GB": {
          "plain": "Insert the spring with 2 spring caps into the fork of the fitting device (Drawing 3)¹). Note: When inserting, the slots of the spring caps must be aligned one above the other.",
          "runs": [
            {
              "text": "Insert the spring with 2 spring caps into the fork of the fitting device (Drawing 3)¹). Note: When inserting, the slots of the spring caps must be aligned one above the other.",
              "bold": false
            }
          ]
        },
        "es-ES": {
          "plain": "Introducir el resorte con 2 platillos de resorte en la horquilla del dispositivo (dibujo 3)¹). Atención: al insertarlos, las ranuras de los platillos de resorte deben quedar alineadas una sobre otra.",
          "runs": [
            {
              "text": "Introducir el resorte con 2 platillos de resorte en la horquilla del dispositivo (dibujo 3)¹). Atención: al insertarlos, las ranuras de los platillos de resorte deben quedar alineadas una sobre otra.",
              "bold": false
            }
          ]
        }
      },
      "label_keys": {
        "de": null,
        "en-GB": null,
        "es-ES": null
      }
    },
    {
      "id": "d65250b-bild044",
      "number": 44,
      "image": null,
      "status": "candidate_crop",
      "captions": {
        "de": {
          "plain": "Stift von hinten durch den Lagerdeckel und Bremsbacke stecken. Gespannte Feder auf den Stift schieben und Splint einführen. Splint aufbiegen. Wenn keine Vorrichtungsgabel vorhanden ist, lassen sich die Federn auch von Hand einsetzen.",
          "runs": [
            {
              "text": "Stift von hinten durch den Lagerdeckel und Bremsbacke stecken. Gespannte Feder auf den Stift schieben und Splint einführen. Splint aufbiegen. Wenn keine Vorrichtungsgabel vorhanden ist, lassen sich die Federn auch von Hand einsetzen.",
              "bold": false
            }
          ]
        },
        "en-GB": {
          "plain": "Push the pin through the bearing cover and brake shoe from behind. Slide the compressed spring onto the pin and insert the split pin. Bend the split pin open. If no fitting-device fork is available, the springs can also be fitted by hand.",
          "runs": [
            {
              "text": "Push the pin through the bearing cover and brake shoe from behind. Slide the compressed spring onto the pin and insert the split pin. Bend the split pin open. If no fitting-device fork is available, the springs can also be fitted by hand.",
              "bold": false
            }
          ]
        },
        "es-ES": {
          "plain": "Introducir el perno por detrás a través de la tapa de cojinete y la zapata de freno. Deslizar el resorte comprimido sobre el perno e introducir el pasador. Abrir las aletas del pasador. Si no se dispone de la horquilla del dispositivo, los resortes también pueden montarse a mano.",
          "runs": [
            {
              "text": "Introducir el perno por detrás a través de la tapa de cojinete y la zapata de freno. Deslizar el resorte comprimido sobre el perno e introducir el pasador. Abrir las aletas del pasador. Si no se dispone de la horquilla del dispositivo, los resortes también pueden montarse a mano.",
              "bold": false
            }
          ]
        }
      },
      "label_keys": {
        "de": null,
        "en-GB": null,
        "es-ES": null
      }
    }
  ],
  "status": {
    "transcription": "draft",
    "en-GB": "draft",
    "es-ES": "draft",
    "figures": "pending"
  }
}
